1,"Verificar Notas Alecson","Verificar o por que que o Alecson conseguia transmitir notas com cfop de devolução sem chave referênciada. Lucas enviou exemplos no Wpp.",fila,fechado
2,"Recarregar número final 9603 20/08","Recarregar esse número para não perdermos ele. Pedir ao Xandão para recarregar (tome cuidado, ele sempre tá puto). Recarregar dia 20/08.",fila,aberto
3,"Nota do Hygor sem transmissão","Tem uma nota com um problema que não consegue ser transmitida. Verificar e tentar resolver a questão.",importante,fechado
4,"Ver jogo da Epic Games","Entrar na Epic Games e baixar o jogo que tiver",fila,fechado
5,"Carregador do notebook do Isaac","Achar o carregador do notebook BH-ENGAGEELETRO-02 do Isaac. Olhar histórico do notebook no só resolve. Antes era da Yasmin e depois passou para o Isaac. O Mateus pode ter pego emprestado novamente.",importante,aberto
6,"Produto problemático sku: 34118","Olhar com o Daniel Duarte a respeito desse produto, pois está muito estranho. E o estoque também está bem esquisito. Ao resolver essa questão, realizar o reenvio conforme orientação da Eliane.Daniel Duarte disse que estava ok, próximo passo é olhar a questão do estoque do reenvio.",urgente,fechado
7,"MUITO PEDIDO SEM ESTOQUE","Pedidos da Shopee sem estoque do mesmo produto, todo o estoque está em ES, mas os pedidos estão caindo em EX. Primeiro inativamos o produto para não vender e fomos seguindo instruções do Nikolas, que agora está resolvendo.",urgente,fechado
